{
  "title": "Komplexe SQL-Join-Aufgabe mit mehreren Tabellen",
  "topic": "SQL-Joins",
  "points_total": 15,
  "problem": "Gegeben sind drei Tabellen: Kunden (ID, Name, Stadt), Bestellungen (BestellID, KundeID, Datum) und Produkte (ProduktID, Name, Preis). Schreibe eine SQL-Abfrage, die für jeden Kunden die Gesamtzahl der Bestellungen, die Gesamtzahl der Produkte und den durchschnittlichen Produktpreis pro Bestellung ausgibt. Berücksichtige nur Bestellungen aus dem Jahr 2023.",
  "expected_steps": [
    "Tabellenverknüpfung mit INNER JOIN",
    "Filterung nach Jahr 2023",
    "Gruppierung nach Kunde",
    "Aggregation mit COUNT, SUM, AVG"
  ],
  "solution": "SELECT k.Name, COUNT(b.BestellID) AS Bestellungen, COUNT(p.ProduktID) AS Produkte, AVG(p.Preis) AS Durchschnittspreis FROM Kunden k INNER JOIN Bestellungen b ON k.ID = b.KundeID INNER JOIN Produkte p ON b.BestellID = p.BestellID WHERE YEAR(b.Datum) = 2023 GROUP BY k.ID, k.Name;"
}