{
  "title": "Hauptachsentransformation einer Matrix",
  "topic": "Lineare Algebra",
  "points_total": 15,
  "problem": "Gegeben sei die symmetrische Matrix A = [[3, 2], [2, 6]]. Berechne die Hauptachsentransformation, indem du die Eigenwerte und Eigenvektoren bestimmst und die Matrix diagonalisierst.",
  "expected_steps": [
    "Eigenwerte berechnen",
    "Eigenvektoren bestimmen",
    "Diagonalisierungsmatrix aufstellen",
    "Matrix diagonalisieren"
  ],
  "solution": "Diagonalisierte Matrix D = [[5, 0], [0, 4]]"
}